{"airport_geometry":{"bearing_reference":"published-geographic-true-degrees","ground_payload_sha256":"b2c53308fdc427900d84b541aff51ba66cbb71bc483fcee0ea16d067dbd15cfb","position_frame":"anchor-eus-metres","runways":[{"ends":[{"designator":"11","eus_m":[{"$binary64_le":"33f7e4ea2eb186c0"},{"$binary64_le":"d0d4d43234943140"},{"$binary64_le":"7ab1d0296bc959c0"}],"published_true_bearing_deg":{"$binary64_le":"0000000000c05f40"}},{"designator":"29","eus_m":[{"$binary64_le":"5c4d4cb029cc5e40"},{"$binary64_le":"271e06f7da523040"},{"$binary64_le":"6d2b054e6cea8040"}],"published_true_bearing_deg":{"$binary64_le":"0000000000307340"}}],"footprint_mm":[[-719239,-112253],[-733057,-94042],[116281,550408],[130099,532197]],"id":"kawo.runway.11-29","material_polygon_id":"kawo.runway.11-29","published_length_m":{"$binary64_le":"a2b437f8c2a89040"},"width_m":{"$binary64_le":"5c8fc2f528dc3640"}},{"ends":[{"designator":"16","eus_m":[{"$binary64_le":"6f0068ea99406740"},{"$binary64_le":"ce46ca9868303440"},{"$binary64_le":"84ba912af0dd8dc0"}],"published_true_bearing_deg":{"$binary64_le":"0000000000606640"}},{"designator":"34","eus_m":[{"$binary64_le":"3b315a6705766a40"},{"$binary64_le":"bb4682d1c6183040"},{"$binary64_le":"caa3ac3c7be98440"}],"published_true_bearing_deg":{"$binary64_le":"0000000000707640"}}],"footprint_mm":[[201257,-955983],[170781,-955502],[196450,669426],[226926,668944]],"id":"kawo.runway.16-34","material_polygon_id":"kawo.runway.16-34","published_length_m":{"$binary64_le":"0612143fc6649940"},"width_m":{"$binary64_le":"7b14ae47e17a3e40"}}],"schema":"CompiledAirportGeometry/v1","source_airport_sha256":"63463d30c55f8aba56a3426efd7c2dd61287a99d66d307f3940b589b97fd6c18","world_anchor":{"ellipsoid_height_m":{"$binary64_le":"0000000000000000"},"latitude_rad":{"$binary64_le":"fdfc84c1e5e5ea3f"},"longitude_rad":{"$binary64_le":"5eedd3837e0e01c0"}}},"construction":{"initial_y_m":{"$binary64_le":"0000000000000000"},"last_delta_limit_m":{"$binary64_le":"000000000000303f"},"method":"anchor-up-fixed-point-v1","post_round_residual_limit_m":{"$binary64_le":"000000000000503f"},"pre_round_residual_limit_m":{"$binary64_le":"000000000000303f"},"reverse_horizontal":"inverse-epsg1188-then-forward-utm10n","reverse_vertical":"inverse-epsg9595-with-positive-zero-height","rounding":"ieee754-binary32-nearest-even","updates":8},"contract_id":"kawo-approx-terrain-v1","frame":{"horizontal_policy":"epsg1188-geog2d-approximation","source_epoch_year":null,"source_realization":null,"total3d_accuracy":"unknown","vertical_policy":"navd88-plus-geoid18-unverified-frame","world_anchor":{"ellipsoid_height_m":{"$binary64_le":"0000000000000000"},"latitude_rad":{"$binary64_le":"fdfc84c1e5e5ea3f"},"longitude_rad":{"$binary64_le":"5eedd3837e0e01c0"}}},"grid":{"columns":3073,"east_origin_m":-6144,"rows":2049,"south_origin_m":-4096,"spacing_m":4,"valid_words":98385,"vertices":6296577},"inputs":[{"bytes":37101,"locator":"source-pair:airport","role":"airport","sha256":"63463d30c55f8aba56a3426efd7c2dd61287a99d66d307f3940b589b97fd6c18"},{"bytes":15785,"locator":"source-pair:dossier","role":"dossier","sha256":"974345fd8eedff2e339e4eb21b8ac3a09ed69c66c4d2a045b430f9655bd15cee"},{"bytes":494331204,"locator":"https://prd-tnm.s3.amazonaws.com/StagedProducts/Elevation/1m/Projects/WA_Western_North_2016/TIFF/USGS_one_meter_x55y534_WA_Western_North_2016.tif","role":"tile55","sha256":"c0115806df9b1c228b8c074adcdd342bb9a01cf936d2c39be218a5b61ead0ccf"},{"bytes":12169,"locator":"https://prd-tnm.s3.amazonaws.com/StagedProducts/Elevation/1m/Projects/WA_Western_North_2016/metadata/USGS_one_meter_x55y534_WA_Western_North_2016_meta.xml","role":"tile55_metadata","sha256":"ef382998233ddd833be510e4737c3052f20718e9fe2b2bea523c42cbc3952381"},{"bytes":497020458,"locator":"https://prd-tnm.s3.amazonaws.com/StagedProducts/Elevation/1m/Projects/WA_Western_North_2016/TIFF/USGS_one_meter_x56y534_WA_Western_North_2016.tif","role":"tile56","sha256":"b62bd2d39d081642fd2b1710a2e3971a216702903b36812304a61ec79f6ac97e"},{"bytes":12170,"locator":"https://prd-tnm.s3.amazonaws.com/StagedProducts/Elevation/1m/Projects/WA_Western_North_2016/metadata/USGS_one_meter_x56y534_WA_Western_North_2016_meta.xml","role":"tile56_metadata","sha256":"c969dc8fcc548ef0670e3fb315ea461cc1f1f59461539816e3b946328f91f8dc"},{"bytes":76231,"locator":"tool-qualification:terrain-tools-v1","role":"tool_qualification","sha256":"71c0e5b2251dbe1c8e97c163b2cd7dd9237ee02b47e4b73c6732ee517458312c"}],"limitations":["generic NAD83 realization and epoch unknown","GEOID18 evaluated under an unverified NAD83(2011) assumption","NAVD88 DEM and FAA feet MSL are separate","total3D accuracy UNKNOWN","EPSG1188 published4m is an operation component only","obstacle and airport operational detail incomplete","material coefficients are original prototypes"],"mosaic":{"max_overlap_difference_m":{"$binary64_le":"0000000000c85d3f"},"overlap_columns":12,"overlap_word_mismatches":103896,"policy":"global-lattice-owner-before-bilinear","seam_easting_m":560000,"source_sample_offset_m":{"$binary64_le":"000000000000e03f"}},"operations":[{"area_of_use":{"east_deg":-47.74,"north_deg":86.46,"south_deg":23.81,"west_deg":-172.54},"axis_in":["latitude","longitude"],"axis_out":["latitude","longitude"],"definition":"proj=noop ellps=GRS80","direction":"forward","grids":[],"id":"horizontal-epsg1188","projjson":"{\"$schema\":\"https://proj.org/schemas/v0.7/projjson.schema.json\",\"accuracy\":\"4.0\",\"area\":\"North America - onshore and offshore: Canada - Alberta; British Columbia; Manitoba; New Brunswick; Newfoundland and Labrador; Northwest Territories; Nova Scotia; Nunavut; Ontario; Prince Edward Island; Quebec; Saskatchewan; Yukon. United States (USA) - Alabama; Alaska (mainland); Arizona; Arkansas; California; Colorado; Connecticut; Delaware; Florida; Georgia; Idaho; Illinois; Indiana; Iowa; Kansas; Kentucky; Louisiana; Maine; Maryland; Massachusetts; Michigan; Minnesota; Mississippi; Missouri; Montana; Nebraska; Nevada; New Hampshire; New Jersey; New Mexico; New York; North Carolina; North Dakota; Ohio; Oklahoma; Oregon; Pennsylvania; Rhode Island; South Carolina; South Dakota; Tennessee; Texas; Utah; Vermont; Virginia; Washington; West Virginia; Wisconsin; Wyoming.\",\"bbox\":{\"east_longitude\":-47.74,\"north_latitude\":86.46,\"south_latitude\":23.81,\"west_longitude\":-172.54},\"id\":{\"authority\":\"EPSG\",\"code\":1188},\"method\":{\"id\":{\"authority\":\"EPSG\",\"code\":9603},\"name\":\"Geocentric translations (geog2D domain)\"},\"name\":\"NAD83 to WGS 84 (1)\",\"parameters\":[{\"id\":{\"authority\":\"EPSG\",\"code\":8605},\"name\":\"X-axis translation\",\"unit\":\"metre\",\"value\":0},{\"id\":{\"authority\":\"EPSG\",\"code\":8606},\"name\":\"Y-axis translation\",\"unit\":\"metre\",\"value\":0},{\"id\":{\"authority\":\"EPSG\",\"code\":8607},\"name\":\"Z-axis translation\",\"unit\":\"metre\",\"value\":0}],\"remarks\":\"Derived at 354 stations. Accuracy 2m in each axis.\",\"scope\":\"Military survey.\",\"source_crs\":{\"coordinate_system\":{\"axis\":[{\"abbreviation\":\"Lat\",\"direction\":\"north\",\"name\":\"Geodetic latitude\",\"unit\":\"degree\"},{\"abbreviation\":\"Lon\",\"direction\":\"east\",\"name\":\"Geodetic longitude\",\"unit\":\"degree\"}],\"subtype\":\"ellipsoidal\"},\"datum\":{\"ellipsoid\":{\"inverse_flattening\":298.257222101,\"name\":\"GRS 1980\",\"semi_major_axis\":6378137},\"name\":\"North American Datum 1983\",\"type\":\"GeodeticReferenceFrame\"},\"id\":{\"authority\":\"EPSG\",\"code\":4269},\"name\":\"NAD83\",\"type\":\"GeographicCRS\"},\"target_crs\":{\"coordinate_system\":{\"axis\":[{\"abbreviation\":\"Lat\",\"direction\":\"north\",\"name\":\"Geodetic latitude\",\"unit\":\"degree\"},{\"abbreviation\":\"Lon\",\"direction\":\"east\",\"name\":\"Geodetic longitude\",\"unit\":\"degree\"}],\"subtype\":\"ellipsoidal\"},\"datum_ensemble\":{\"accuracy\":\"2.0\",\"ellipsoid\":{\"inverse_flattening\":298.257223563,\"name\":\"WGS 84\",\"semi_major_axis\":6378137},\"members\":[{\"name\":\"World Geodetic System 1984 (Transit)\"},{\"name\":\"World Geodetic System 1984 (G730)\"},{\"name\":\"World Geodetic System 1984 (G873)\"},{\"name\":\"World Geodetic System 1984 (G1150)\"},{\"name\":\"World Geodetic System 1984 (G1674)\"},{\"name\":\"World Geodetic System 1984 (G1762)\"},{\"name\":\"World Geodetic System 1984 (G2139)\"},{\"name\":\"World Geodetic System 1984 (G2296)\"}],\"name\":\"World Geodetic System 1984 ensemble\"},\"id\":{\"authority\":\"EPSG\",\"code\":4326},\"name\":\"WGS 84\",\"type\":\"GeographicCRS\"},\"type\":\"Transformation\"}","published_accuracy_m":4.0,"units_in":["degree","degree"],"units_out":["degree","degree"]},{"area_of_use":{"east_deg":180.0,"north_deg":90.0,"south_deg":-90.0,"west_deg":-180.0},"axis_in":["longitude","latitude"],"axis_out":["easting","northing"],"definition":"proj=pipeline step proj=unitconvert xy_in=deg xy_out=rad step proj=utm zone=10 ellps=GRS80","direction":"forward","grids":[],"id":"source-utm10n","projjson":"{\"$schema\":\"https://proj.org/schemas/v0.7/projjson.schema.json\",\"accuracy\":\"0\",\"area\":\"World\",\"bbox\":{\"east_longitude\":180,\"north_latitude\":90,\"south_latitude\":-90,\"west_longitude\":-180},\"name\":\"axis order change (2D) + UTM zone 10N\",\"source_crs\":{\"coordinate_system\":{\"axis\":[{\"abbreviation\":\"Lon\",\"direction\":\"east\",\"name\":\"Geodetic longitude\",\"unit\":\"degree\"},{\"abbreviation\":\"Lat\",\"direction\":\"north\",\"name\":\"Geodetic latitude\",\"unit\":\"degree\"}],\"subtype\":\"ellipsoidal\"},\"datum\":{\"ellipsoid\":{\"inverse_flattening\":298.257222101,\"name\":\"GRS 1980\",\"semi_major_axis\":6378137},\"id\":{\"authority\":\"EPSG\",\"code\":6269},\"name\":\"North American Datum 1983\",\"type\":\"GeodeticReferenceFrame\"},\"name\":\"NAD83 (with axis order normalized for visualization)\",\"remarks\":\"Axis order reversed compared to EPSG:4269\",\"type\":\"GeographicCRS\"},\"steps\":[{\"id\":{\"authority\":\"EPSG\",\"code\":15498},\"method\":{\"id\":{\"authority